<?xml version="1.0" encoding="UTF-8"?>

<p:CstmrDrctDbtInitn xmlns:p="http://univ.fr/sepa" xmlns:xsi="http://www.w3.org/2001/XMLSchema-instance" xsi:schemaLocation="http://univ.fr/sepa tp1.sepa.01.xsd ">
  <p:DrctDbtTxInf>
    <PmtId>TEST#001</PmtId>
    <InstdAmt Ccy="">1003.80</InstdAmt>
    <p:DrctDbtTx>
      <MndtId>FF-57-E7</MndtId>
      <DtOfSgntr>2001-01-01</DtOfSgntr>
    </p:DrctDbtTx>
    <p:DbtrAgt>
      <BIC>DAEOFRPPCCT</BIC>
    </p:DbtrAgt>
    <p:Dbtr>
      <Nm>Mr Dupont</Nm>
    </p:Dbtr>
    <p:DbtrAcct>
      <IBAN>FE1405643596877A</IBAN>
    </p:DbtrAcct>
    <RmtInf>Ceci est un commentaire</RmtInf>
  </p:DrctDbtTxInf>
  <p:DrctDbtTxInf>
    <PmtId>TEST#002</PmtId>
    <InstdAmt Ccy="">1004.80</InstdAmt>
    <p:DrctDbtTx>
      <MndtId>FF-57-E8</MndtId>
      <DtOfSgntr>2001-01-02</DtOfSgntr>
    </p:DrctDbtTx>
    <p:DbtrAgt>
      <BIC>DAEOFRPPCC</BIC>
    </p:DbtrAgt>
    <p:Dbtr>
      <Nm>Mme Dupont</Nm>
    </p:Dbtr>
    <p:DbtrAcct>
      <IBAN>FE1405643596877Z</IBAN>
    </p:DbtrAcct>
    <RmtInf>Ceci est un deuxi√®me commentaire</RmtInf>
  </p:DrctDbtTxInf>
</p:CstmrDrctDbtInitn>
